{
  "event_id": "11111111-2222-4333-8444-555555555501",
  "timestamp": "2025-03-15T09:00:00Z",
  "event_type": "person_enter",
  "source": {
    "source_type": "camera",
    "source_id": "CAM-Z0-01",
    "source_name": "Lobby Main Camera"
  },
  "actor": {
    "entity_type": "person",
    "entity_id": "P001",
    "entity_name": "Alice Chen",
    "badge_id": "B-1001",
    "account_id": "achen",
    "track_id": "trk_101"
  },
  "target": {
    "entity_type": "zone",
    "entity_id": "Z0",
    "entity_name": "Lobby / Reception"
  },
  "object": null,
  "device": {
    "device_id": "CAM-Z0-01",
    "device_type": "camera",
    "device_name": "Lobby Camera 01",
    "ip_address": "10.0.0.10",
    "mac_address": "00:1A:2B:3C:4D:01"
  },
  "location": {
    "zone_id": "Z0",
    "zone_name": "Lobby / Reception",
    "building": "Main Campus",
    "floor": "1",
    "coordinates": {
      "x": 12.5,
      "y": 8.0
    }
  },
  "attributes": {
    "detection_class": "person",
    "bbox": [
      120,
      80,
      240,
      360
    ],
    "direction": "inbound"
  },
  "confidence": 0.94,
  "raw_ref": "frames/cam_z0_01/frame_00120.jpg"
}